{
  "schemaVersion": 1,
  "dataViewLabId": "visual-fidelity-data-view-lab",
  "revision": "cohort-r3-absent",
  "lineage": { "source": "bundled-fixture", "parentRevision": "cohort-r2-partial" },
  "decisionNeed": "exact-values",
  "dataStanding": "absent",
  "scope": "Cross-functional review stages",
  "unit": "cases",
  "denominator": "per weekly review",
  "records": [],
  "relationships": []
}
